text,label,idx
Our teacher had invited us to lunch and once at the canteen westarted introducing ourselves.Two of the boys showed a lot ofinterest in knowing personal details and then they startedtalking about some activities held in the college.I had littleinterest in those activities so I talked to another studentsitting next to me as I was afraid that they would ask mequestions on those activities.,6,1298
"When we had swimming instruction, we had to take a header fromthe springboard. I usually refused to do that, but at least I wasforced to.",0,1299
One day in the TYBA class the teacher asked me a very simplequestion which I could not answer.Finally the teacher himselfgave us the answer and my friends started laughing at me as I hadnot been able to answer a simple question.I knew the answer butfeared that my response may be wrong.All this made me feelashamed of myself. ,6,1300
"A ex-boyfriend tried to prejudice me before my fiancT and hisfamily saying things about me that let his family worried. We hadto postpone our wedding and we were already using our weddingrings. To be honest I didn't feel just anger, I felt hate.",3,1301
At the begining of a new course one is afraid of encounteringproblems one can not manage.Thoughts revolve around failingthe subject and the consequences it would have for the future.,1,1302
When I was acceptted as a student of psychology.,4,1303
"At my temporary job, I have to restrictothers' actions and makethem obey me, and this very often gives mea feeling of guilt.Iwish there could be some other way of acting.",5,1304
"At a meeting with over one hundred people, they decided who had to speakfrom the stand by drawing lots.",6,1305
On seeing a scene of an accident in a magazine.,2,1306
When I learned that my dad had cancer. I knew he was going to thehospital for some tests. My mom told me when she picked me up oneweekend from CAL to take me home.,1,1307
When I failed the grade seven exams.,6,1308
[ No response.],2,1309
I felt sad when a thief stole all the clothes from my friend'scupboard at school (boarding).,1,1310
A too eager approach by a dirty drunken person in a bus.,2,1311
"When I passed the B.A exams with 1st class.I was the first inthe family to have got a 1st class, so all the family memberswere very happy and they gave me the opportunity to studyfurther.",4,1312
It was when my father caught me with a girl in dark corners andasked me what I was doing there.,6,1313
When I am dirty because I have not had a shower for a few days.,2,1314
"My guinea-pig had been ill for a couple of days.One evening,when I came home I enquired as to how it was doing.My mother'sexpression told me that it had died.My knees refused to supportme and I began to weep convulsively.",1,1315
I felt guilt because on account of my ambitions I nearly turnedmy sister out of my parents home.,5,1316
"When I see that some people remain cold and egoistic with regardto close friends, even in situations that those friends needthem.",2,1317
On holidays - just driving along a road beautiful scenery. Justwith my boyfriend - not really talking but just feelingoverwhelmed.,4,1318
Receiving a nice present from my parents.,4,1319
"When I impregnated a certain girl, I thought that I would beforced to marry her or go to court.",0,1320
While I was waiting for them to give me the marks of the mostdifficult subject this year.,0,1321
Some men were talking about me and my sister.,6,1322
My son was born.,4,1323
I told my pesent boyfriend that I was an Australian as are myparents. As the relationship developed I found it harder andharder to confess and became sure it would end our relationship.He eventually found out when told in front of me by my mother.,5,1324
When I was punished in school for no serious mistake of mine.,3,1325
"One night we, all the family members, were sitting in the frontcorridor of the house when a gentleman looking person came in. He was my father's client and he had come to bribe my father inconnection with the proceeding case.At my father's refusal heabused my father, my brother and I could not control our temperand we rushed at him.",3,1326
I was angry when my boyfriend did not turn up as promised.,3,1327
When I saw a film in which the man suffered from an illness and his skin came peeling off.,2,1328
Once I was alone at home. I suddenly felt unwell and there was noone to help me and call First Aid.,0,1329
Power cut made me unable to listen to the songs sung by myfavourite pop star.,1,1330
"The day before the university results came out I was both excitedand scared.If I failed I did not know what I would do as I didnot want to work, my family was ambivalent.",0,1331
When my husband stays late at a meeting and I have to be alone.,3,1332
I was at home and I heard a loud sound of spitting outside thedoor.I thought that one of my family members would step on the spitand bring the germs in the house.,2,1333
"I was terribly upset when my kitten got hit by a car. He didn'tdie, but for several weeks we thought he might have to be putdown.",1,1334
I feel anger when things don't come out as I wish.,3,1335
One day I felt dizzy during a lecture.When the lecturer askedus as to who had heard the fairy tale - I was the only one whoput up his hand and this surprised the whole class.,6,1336
"When someone pointed out that I was proud, yet I didn't dress upproperly. This was when I and my friend went for a dnce oneSaturday.",6,1337
"One day I lent my tennis I just had washed to my sister becauseshe asked it. I asked her not to soil it as I had just washed it.Next day I looked at the tennis, and it was dirty with wax. Shecould not have soiled it. It was lack of consideration. I feltvery angry.",3,1338
Once when I was in the cell group (religious activity) I foundthat almost everyone in the group read the bible daily and I feltguilty in my heart.,5,1339
"I bumped my dad's car in a lamp post.He was not at home then,neither was he home when I left for the campus.I did not tellhim about the accident and I will never tell him.",5,1340
The day some friends of mine and I decided to go to Galicia onholiday.,4,1341
"When my father addressed me directly and maliciously, thusincluding me in the \family war\"".""",3,1342
When my grandmother died - at her funeral.,1,1343
"When having a relationship, I made love with another girl.",5,1344
"I felt anger when at the end of a telephone call, a good friendtold me that she would go to travel next year with another goodfriend. We couldn't talk this out.",3,1345
"Having agreed to share the taxi expenses, three people in theback of the car just ran off, leaving the person up front withthe entire bill.",3,1346
I couldn't fulfill a promise.,5,1347
"When I was very young, one day, I kicked my grandmother andcaused her an injury which took a long time to heal.",5,1348
"When I realized that I had been wrong about a person close to me,because of pre-set ideas and prejudices.",6,1349
This happens to me when I am not prepared in a given subject.,6,1350
"When I was 9 years old, I got a cat, but after 3 days he died. Iwas very sad, because I had nursed him and taken him to theveterinary's - but in vain. Although I had had him only for ashort time I had liked him very much.",1,1351
A young man was insulting and humiliating a drunken man.,2,1352
Came back from surfing to find car broken into and gear and moneystolen.,3,1353
When we were able to afford a new sofa - a leather one which costSEK 20000.I had waited for it for 2-3 years.,4,1354
[ I feel a sense of joy whenever I complete a piece of writingwhich is part of my work.Intense reading also brings me joy.Ialso feel happy when I reminiscent about them.],4,1355
Caught lying to my father about a speeding ticket I had received.,6,1356
When I tried to hide a fact from a person for irrelevant reasonsand considered such an attitude childish.,6,1357
I was 4-5 years old when I hid the bicycle keys of a not verygood friend.After a few hours I pretended that I had foundit.,5,1358
A teacher giving a test was called by a student by his firstname. He (the teacher) said that he didn't give him this liberty.,2,1359
A colleague asked me to study with her. I could not explainthings as perfectly as she had expected. So she reacted in anaggressive manner.,3,1360
"I had promised to do a task for someone that was close to me, andfrom the outset I knew it was important that I do it, but when itcame to it, I let them down.",5,1361
"As a child I suffered of nightmares. Even since than, I havenever been so anxious and fearful.",0,1362
When I entered a brothel and saw two sailors with a youngprostitute who was not older than 18.,2,1363
"An ex-colleague asked me if I was interested in working in theiraccounts bureau.They needed \clever people\"" and he had\""immediately thought of me.\""""",4,1364
[ A successful lesson.],4,1365
"When given responsibility to grade papers in elementary school, Icheated a little and graded my own higher.",6,1366
"A day when I was getting out of the shower I covered only thefront part of my body with a towel (I was 7 years old), and Ididn't see that my cousin was in the room.",6,1367
"In a dam lake, when the water was let flow to water the plantsand I and two other boys were near the water pit. We rescuedourselves only thanks to the flippers and the tyre that was withus.",0,1368
"I went to the prayer meeting at night and unfortunately the carbroke down, so my other sister said I had to walk alone fromNdirande to Chirimba at around midnight. So we reached home at1 am. I was afraid of robbers and dardness.",0,1369
My boy-friend had promised me to come an 10 a.m. - he was 3 hourslate.,3,1370
Talking to someone I disliked.,2,1371
When I refused to fetch water for my aunty while she was busy.,6,1372
Missing lectures and avoiding university work for no reason whenit had to be done.,5,1373
Scoared a goal in a football match.,4,1374
I experienced this emotion when my grandfather passed away.,1,1375
"The first time I saw a pornographic film, all that in practice isso beautiful but on the screen appered as something mechanical,irrational, disgusting and dehumanizing.",2,1376
I was scared when I realized that I might miss the train which Iwas supposed to take.I was 1500 Kilometres away from home and when I heard the depart whistle I was still 150 feet away from thetrain.I finally made it.,0,1377
The discovery that one has only thought of oneself.,6,1378
My boyfriend and I did not have any contact with each other during the Summer holidays.I met him the day of the registration and looked through him.In the canteen he asked me if I wanted to have a drink and I said no as I did not want him to do me a favour.,2,1379
When my nephew was taken to hospital with meningitis and we didnot know what would happen.,1,1380
When my mum learnt that I had beaten up someone in a fight.,6,1381
"I talked with a man who stammered and without controlling myself,I started to talk imitating him.",6,1382
Doesn't apply.,2,1383
Before an important examn.,0,1384
I joked with an unfamiliar friend in an obstinate tone.I wasafraid of his misunderstanding me and being hurt and angry at me. I felt sorry over my conduct and thought that I had to find anopportunity to apologize.,5,1385
Before an examination: I had the fealing that I had not learnedenough.,0,1386
When my father passed away.,1,1387
I had quarelled with a friend of mine and I later realized thatit was also my fault.,5,1388
When I heard that my father had passed away. I could not eat fora week and was only crying. I could not find the courage to go tobath.,1,1389
The day my parents were involved in a car accident and had to beoperatedand before the operation the doctor said that it wasmater of life or death.,0,1390
In cinema I saw a film which showed how a person was torn out hisguts when he was still alive.,2,1391
"When I was a child, one day, I was going home late at night and Idid not notice an uncovered man hole and fell in it.I was in there forseveral minutes.",0,1392
A good report card (a scholarship) in primary school.,4,1393
"When my parents work very hard and get tired - while I go toschool and study instead of helping them. I feel that I'm lettingthem down, disappointing them.",5,1394
When I made love with someone who I didn't really love. SometimesI even considered him unlikable.,2,1395
"[ During a summer holiday a French girl and I had becoe backhome, I felt very sad.]",1,1396
"I was carried away while talking about my visits abroad and Itended to boast a little, till I realized that the listener wasamused.",6,1397
I had gone to the hospital for my research and got late inreaching home.I feared that when I reached home there would bea quarrel because of my being late.,0,1398
Being insulted in public.,6,1399
"One day, I was alone on duty when a patient choked while eating. I ran to her and tried to make her breath, but it was too late.",5,1400
"I \cooked\"" the engine in my father's car - it was actually his fault because he hadn't fixed the temperature gauge or told me. When I finally got home I was absolutely screamed at and the anger I experienced was over the injustice of it all plus the huge row which developed.""",3,1401
Sincerely I'm a very timid guy and so even in very simplesituations sometimes I am ashamed.,6,1402
"When I was misleaded by a person who assured that something wouldnot occur, that I had no reason to prepccupy myself, and suddenlyI saw myself implicated by the fact, because of the incompetence,and irresponsibility of that person.",3,1403
When my boyfriend once again told me that he loved me after aperiod in which he felt very depressive.,4,1404
I was angry when I watched a ski-race. All the Austrian skiersdropped out.,3,1405
"In 1982, I was annoyed at an uncle who was drunk and was beatingup his old father.He claimed that the father was responsiblefor his guardian's failure.",3,1406
[ No response.],3,1407
"When I was young I was playing football near my parent's houseand while playing I fell on the ground. At first I thought I wasnot seen by anybody, but when my mother laughed I felt veryashamed.",6,1408
Watching Muldoon act as my P.M.,6,1409
"My best friend started moving out with my boyfriend. When I heardthis my heart sank because I didn't expect that my own goodfriend could do such a thing, so I got angry.",3,1410
Arguing with my younger cousin.She is rather a nuisance but Ifelt sorry.,5,1411
When the Cambridge results came out and I obtained a firstdivision.I had been thinking that I had not done very well.,4,1412
I have been thinking of changing my major for a few months.Myoriginal major was Chinese language and it blocks my way.I haveto face many problems at the sametime and I do not know what isreal and virtuous.I do not know if I am not interested inChinese or if there are other factors which make me sad.I amnot very clear on what I can do for the study of Communicationand Journalism.I am not clear about what I can do.What arethe limitations ? I hesitate but I feel more adjusted now.,1,1413
When I passed the driving test after three failures.,4,1414
Someone stole my ski at Vitosha and of course I was the one to beblamed. I left them without supervision.,3,1415
The assistant professor saw me cheat at the preliminaryexamination.,5,1416
"In the student's union there was someone who took the photocopiesof two large volumes.I asked him to let me take a few, he refusedit for an acceptable reason. ",3,1417
I read a book about the sexual phantasies of women; I read abouta woman having sexual intercourse with a dog.,2,1418
"When I finished my exams after 12th Grade, I was worried aboutgetting a T.E. Score high enough for Physiotherapy. When I foundthat I had been accepted I was ecstatic, or more appropriately,could jump for joy.",4,1419
"An incident occurred to me when I was going home with mygirlfriend. On the way, a man named Banda grabbed my girlfriendin my presence. I was really angry with him and as a result Ithrew stones at him and he ran away.",3,1420
I can't remember ever feeling shame.,6,1421
"I was travelling back home by boat with two friends of mine aftera lovely holiday trip.The night and the sea were dark, and thewind was blowing.I feared that death was there on the boat, Isomehow felt sure about it.I feared being left alone.",0,1422
Every time I meet a certain dog that has once bitten me.,0,1423
Insulting other people.,5,1424
We are repainting rooms in my house. My mother started to enactplans to paint my room without consulting me.,3,1425
"Being insulted in front of my parents, and they believed otherpeople (those insulting me).",3,1426
"When I was watching a movie with many violent episodes.Theyaccurately showed the cutting of corpses, etc...",2,1427
I feel fear quite often but this feeling was very strong lastyear when my husband was quite unexpectedly sent to the hospital.,0,1428
"Having quarreled with a boyfriend, he threatened to leave me.",0,1429
"When I could not pass my exams with good marks.My wedding wasto take place 15 days after the exams and I tried to convincemyself that this was the reason for my not having done well.However, I thought that had I really put my mind to doing well atthe exams I would have done well.",6,1430
When I was ten years old a classmate laughed at me because I hadtold him that my father had retired.,6,1431
I was swimming in the sea and a wave took the top part of mybikini away.,6,1432
When ditched - divorced by husband.,6,1433
When I was left by the person I loved without any reason.,3,1434
I came across a group of people with the same basic ideas/beliefswho were all fighting and going against what they would say wasgood.,2,1435
When my grandmother passed away.,1,1436
My old friend visited me in the university.,4,1437
I was looking at a one-man show on television. He told verydisgusting things so that I started to be disgusted with it.(Later on it proved that this was his intention).,2,1438
A close friend of mine was to get married in a weeks time whenher father died of a heart-attack.I knew him well and felt badon hearing of his death.,1,1439
"Feeling helpless, not being able to accomplish what I reallywanted to do.",5,1440
When I felt powerless to help the poor or when I don't know howto.,1,1441
During the oral part of my final examination I made a mistake inspeaking so that all the teachers laughed at me.,6,1442
"I went shopping with my mother and sister (17 years old). Motheralways told my sister what she should buy. Instead of assistingmy sister in defending herself against mother's interference, Ijust behaved aggressively towards my sister.",5,1443
"I was spending the week-end with some friends.We were waitingfor another friend and we went to the meet him at the bus stop, a woman we met there told us that the coach had already left.Iwas afraid that I would not see my friend, but at last we foundhim.",4,1444
When I was successful at my work I was full of joy.,4,1445
"I was beaten up at a private New Year's party once, through nofault of mine.",0,1446
"When I met a friend whom I had not seen for a long time andheard all about her troubles, I thought that I should have gotin touch with her earlier.",6,1447
[ No response.],5,1448
When I considered writing a load of crap for this emotion.,6,1449
A very close friend of mine died. I read it in the newspaper. Ididn't know what to do and thought about it the whole day.,1,1450
"I tried after months to begin talking to my boyfriend again. Heignored me. I felt I had lowered my pride and became his\doormat\"".""",6,1451
"During lectures, I sensed an unexpressed understanding with a boyI did not know.We exchange glances ; I think he likes me, and Ilike him too.Perhaps he has fallen in love with me .........",4,1452
First day back on the job.,0,1453
"Eating biscuits and drinking Milo (Chocolate energy drink madewith milk and usually drunk warm) with my friend at College. Weget on really well, don't withold any feelings about each other'sfriends and are pretty good at cheering each other up when we arehomesick.",4,1454
We got news that my (almost) 21 years old brother died whilevisiting Europe of a cerebral hemorhage. It finally hit me anhour after we saw his corpse in the coffin. It felt like a doorbetween himself and everything had closed and locked forever.,1,1455
"When I walked to church with my roommate, a bum told us to callthe police and he started following us.",0,1456
"This is an event I will never forget.I am considered a goodmimic.This particular day we were waiting for a professorto take her class.Thisprofessor had a peculiar accent and avery horrible way of lecturing and to top it all we had thisclass at the fag end of the day.So this particular day I gotinto my element and started imitating the professor, and theprofessor entered the class right in the middle of it .I wasunaware of her presence, some of my friends tried to warn me butit was of no avail as I was too engrossed in mimicing.Then Isuddenly noticed the silence and turned around to see herentering the class.I do not know till today if she actually sawwhat I had been doing or she had completely ignored it.Through out that lecture I died of shame.All the more shameful was thefact that she gave me a character certificate. ",6,1457
"Walking on the street passing by an air duct, my skirt went up.",6,1458
At rejection / being ignored by a loved person held in greatesteem.,1,1459
"I was disgusted with my brother's behaviour when he kept throwingthings away because of his anger, after mum had shouted at him.",2,1460
When once again I drank too much and felt very rotten the morningafter.,2,1461
"Nearby the end of the year my wife and I were having a car ride,when it appears another vehicle, driven by a drunk driver andprovokes an accident.",3,1462
Returning to school and rejoining my girlfriend after 3 months ofseparation from summer.,4,1463
Continous fear of a nuclear war.,0,1464
"I thought I would be able to use the mangle of the house, and soI did not want any help.However, I blocked it and I had to getthe janitor to help me out.He reproached me for not havingfollowed the instructions",6,1465
"My friend had organized a birthday party for me secretly, I wasvery happy not so much for the presents but because they seemedto care for me.",4,1466
When I lied at home. I told them that I was going to aChristian meeting and I went to see my boyfriend instead.,5,1467
"[ On discovering the red-tapism and the bureaucratic, corrupt,decadent, degenerated infrastucture of every public utility,office and service; and the rampant corruption at every singlelevel of education and other institutions.]",3,1468
My parents came to visit me.,4,1469
Disgust with drunk people.,2,1470
"At my grandfather's funeral.I remembered that the thing heliked and respected most was earth, I thought that he hadattained what he wanted and was not separated from it any longer.",1,1471
I prayed unfaithfully.,5,1472
I met intoxicated people with dubious intentions in a back alleyone Wednesday night.,0,1473
"A lonely, neurotic, shy girl lives nearby. She has expressed awish to meet me, I have however avoided her (turned down aninvitation) as the crisis my partner is going through uses up allmy empathy.",5,1474
When I was making music together with my friend. It sounded verygood and we were very satisfied.,4,1475
One time I was injured when I was playing football at School inBlantyre. I was brought to the hospital while my leg was totallyswollen. The x-rays confirmed there was no fracture butcollection of blood n the muscles. I feared when they started toincise the swollen part with surgical blade.,0,1476
When I pass an exam.,4,1477
A neighbour complained about smoke from my backyard incineratorentering his house after a change of wind direction. I lit thefire after originally checking that the wind would not blow thesmoke in that direction.,5,1478
I was severely reprimanded for a trivial offence in front ofmembers of my peer group while still at school.,6,1479
There is a mad boy in our village. This boy hit me with a rawpaw-paw in the face.,3,1480
"My mother called me because she had read through the enveloppe a letteraddressed to me.She denied having read it intentionally andsaid \the words just popped out through the enveloppe as the sunwas shining on it\"". Hah Hah.""",2,1481
There is a person whom I disgust. Evrey time I see her I get thisterrible feeling I disgust her whole appearance.,2,1482
A shop in Downtown wouldn't accept my Visa Card - before Decemberlast year.,3,1483
Before giving a seminar to a rather large audience.,0,1484
When on a car journey a fellow student crossed our way with hisown car and we had to bump into a roadside trunk.,3,1485
"When I first heard \I like you !\"" from my boyfriend.""",4,1486
When one of my best friends commited siucide during theseholidays.,1,1487
When my father married a certain lady. The reception was held atKasungu town Hall.,4,1488
When my boyfriend asked me to go out with him and I refusedbecause I wanted to go out with another guy.I did go out and myboyfriend found out.,5,1489
When I think that I have been too stict or narrow minded towardsmy students.,5,1490
Facing the possibility of having a child when it wasn't eitherdesired or permitted.,5,1491
"A man whom I like, was drunk and tried to molest me.",2,1492
"I am a \cantor\"" - I sing psalms in church. Several weeks ago Ihad to sing too, but the organist did not tell me in time. As Idid not know the psalm, I was afraid and said that I could notsing.""",0,1493
"Skiing down a very icy slope, very fast in white-out conditions.Out of control with no idea of what I was doing or where I washeading.",0,1494
"I went to practice in Sweden during summer, and I was afraid thatI would not do well.",0,1495
