text,label,idx
I was once chatting with friends. Then some boys came and joinedus. These boys took all my 3 friends away and I was left alone inshame without knowing where to go from there.,6,2342
Falling in love with a close friend.,5,2343
When I was told that they had got tickets for me for a filmmarathon I wanted to see.,4,2344
My cassmate laughed at me when I was being scolded by theteacher.,3,2345
My 80 year old grandfather underwent three successive operationsduring a single year.The third operation was risky and I wasscared that he would die and feared that my grandmother would bevery sad.,0,2346
When I had to go to reconciliation before converting toCatholicism but then once received - o.k.,5,2347
"When I tried to explain to a plumber, face to face, that thetoilet was broken and he did not believe it (it had been mendedten times).",3,2348
"In a tram, the ticket seller was commanding, taking the role of aleader, trying to emphasize her non-existent authority with unduestrictness towards a good-humoured drunk who could not find histicket at once.",3,2349
When my children were born.,4,2350
Finding out about Chinese money cannot buy foreign journals.,6,2351
"I felt guilty after getting really angry with a friend and havingan argument. I was being stubborn and proud, and selfish, becausemy friend let me down, through no fault of her own.",5,2352
"While having a discussion with a colleague of mine, I realized that herconception of man and work were similar to mine.",4,2353
[ I have not felt this emotion in my life.],6,2354
When I went to see the result of an exam and saw that I hadfailed.,1,2355
Got a present from my friend for my birthday.,4,2356
I felt disgusted on seeing my boyfriend after our separation. One day he was begging at the mass transit railway station and atthat moment I hated him.,2,2357
"At the airport, eighty beer cans that I was carrying in abag spread all around while I was going through the metaldetector.",6,2358
Pictures of Nazi extermination camps on a T.V program.,2,2359
My mother's death.,1,2360
"I was subject to false accusations, and got very angry.",3,2361
I was sleeping nicely until in the middle of the night when I becameawake because a friend called me for some (in my opinion)nonsens reason.,3,2362
When I understood I was admitted to the Sofia University.,4,2363
"After lot of explanation, to fail in my work.",6,2364
China not doing well in the Asian Olympic games.,6,2365
When opened a box of biscuits and found worms inside.,2,2366
Once I saw some children hunting a cat to death.,3,2367
Being chosen to do this experiment.,4,2368
"I was alone at home and I could hear odd noises coming from aboveour bedroom.I knew that nobody lived there since it was anoffice.I got frightened (later I was given a \natural\""explanation).""",0,2369
When I was 12 years old I frequently was pursued by others andgot sound thrashes.,0,2370
"When I was on holiday, walking back to where I was staying, atnight, and two men started closely following me. There was nobodyaround that I could run to.",0,2371
"I was looking after a dying patient at work one night, a youngwoman, my colleague was talking to her relatives and .... tooffer them any support emotionally, physically and then sent themdown to the coffee shop to have a dinner rather than offering thefacilities available for their use cause it involved her havingto do some work. Seeing them again I felt disgusted at herattitude.",2,2372
"A girl in our class was nicknamed \fatsy\"". Later, I heard that she suffered from diabetes mellitus.""",6,2373
When I got a good grade for an exam in statistics.,4,2374
Insulted by a teacher in front of the class.,6,2375
When my dress and a few other things were stolen from mywardrobe.,3,2376
Before an examn.,0,2377
I felt extreme joy the day I was baptized. I was one with God.,4,2378
[ The same as in shame.],5,2379
Making an unexpected talk with a professor in the canteen. Thismade me shy.,6,2380
I received a message that my elder brother was involved in a caraccident and was admitted in hospital.,1,2381
NO RESPONSE.,5,2382
I was camping with a friend of mine and we spent the night in theforest.I could not fall off to sleep and could clearly hearnoises from outside (steps ?) approaching our tent.,0,2383
"I met three drunk boys, almost children, they didn't look likenormal people.",2,2384
It was when I injured a friend accidentally with a stone. It madea cut on the cheeks which resulted in suturing.,5,2385
"I saw a dead child which was not covered, it had been knockeddown by a car.",1,2386
When I cancelled an appointment with an idle story. Afterwardsit appeared that the person had looked forward to it and reservedtime for it.,5,2387
When my friends tried to discriminate against my friendship withcertain other friends which they thought was improper.,3,2388
I heard part of a conversation in which one talked very low aboutwomen.,2,2389
"At school, I had acted against the will of the group, and thenext day they promised to take revenge on me.",0,2390
A friend of mine had sex with someone of a different race on aWinnebago trip down to USC in front of everyone (all my friendsembarrassed my sorority house name).,2,2391
"When I got the midterm exam results, the results were belowaverage and were near the lowest.I was scared of the finalexam.",0,2392
When an argument with a friend of mine over our behaviour towardsanother friend turned into a quarrel. I lost my temper and nearlyknocked him out.,3,2393
Reported neighbour to police for taking to my daughter withbaseball ball - her counsellor rang me and after long talkconvinced me the woman was o.k. I felt guilty for ringing thepolice then guilty for feeling guilty about it.,5,2394
The day I woke up to find that a kitten I had wanted to keep hadbeen eaten by the neighbour's dogs.It had been locked out by mywife who claimed that it had dirtied the sheets.,1,2395
When I wasn't well prepared for a terminal exam and the teachertried to give me a three by asking me some very easy questions. Iburned with shame then.,6,2396
When I slipped on a glazed frost road and a car almost ran intome.,0,2397
"This was when the girl I was in love with accepted my proposaland everything went smoothly, just as I had wanted it to.It wascontrary to my previous feelings of uncertainty about herresponse.",4,2398
Some colleagues decided to go out on a Saturday not inviting meto decide either the place nor the time.,1,2399
"One night, walking along a park, I began to think that someroughnecks would appear suddenly with knives and things likethat.",0,2400
"At our Senior dinner - separated from school friends, nothingwill ever be the same again.",1,2401
When one is unjustly accused of something one has not done.,3,2402
"When someone I trusted very much, disappointed me.",3,2403
For about one year I had a rather bad relation with my father.Last Christmas Eve he invited me to stay withhim and I was veryglad about it. It was a fine evening.,4,2404
When I failed my first biochemistry test.,2,2405
I cannot remember a situation in which I felt ashamed. I waseating with some people and a little boy I took care of. I warnedhim often not to knock down his glass of mild. When I tookout his chair I knocked down my own glass.,6,2406
Whenfell in love with my present girlfriend.,4,2407
China winning the Asian Olympic games (TV).,4,2408
My girlfriend was away visiting another city and I broughtanother girl home. Next morning when I started getting sober Ifelt quite ashamed of myself.,6,2409
Accidentally seeing a friend in a compromising situation with astranger.,2,2410
"When I went to a sauna with my father for the first time (I was16). When I entered the sauna naked, I felt ashamed for a shorttime.",6,2411
When someone told a secret I told them not to tell.,3,2412
I slipped on butter one evening in the Dining Commons landed onmy rear causing my tray also to land on the floor.,6,2413
"The first time that I \played with myself\"" despite being a Christian.I had read in the bible that it was wrong to make love to someone one is not married to.""",5,2414
When I promise to do something but I don't fulfill it.,6,2415
Saw the film about Eight Nations Army conquering Beijing.,6,2416
[ When friends and colleagues talk bad about me.],1,2417
"Once by coincidence I clutched a stranger (in a rather intimateway), thinking it was my boyfriend. When by hindsight Ifeel ashamed when thinking about it.",6,2418
I felt disgusted when my appointment to meet the E.N.T.specialist had been turned down. The specialist came from U.K.and went the same day and we do not have one.,2,2419
When I heard that an acquaintance of mine was spreading rumoursabout my affair with a close friend.,3,2420
When a close friend of mine collapsed and passed away and theillness was not known.,1,2421
"My classmate got a \B\"" for his homework while I only got a \""C\"".When we got the results he acted as if he did not merit this grade.I found that his humility was hypocritical and I found it disgusting.""",2,2422
When people next to me play the fool.,6,2423
"Sort of awkward. I'd introduced (a lover) but introduced as afriend to some members of my family, and my niece Yavanna who'ssix was home from school and at Mum's and Dad's and was reallysilly and at first it was ok, but it went on and on - yukky pooh!You eat your snot, etc. and I felt cross she wouldn't stop. Butshe had an audience and was in one of those moods. Once I'daccepted it was something everyone does at time I felt better -it was partly having my friend there.",2,2424
I am disgusted with a nieghbour who is looking for all sorts ofquarrel with my parents and me. He feels we are hampering hisliving close to us. This has been going on for quite a long time.,2,2425
When my father died.,1,2426
"At an examination I got a bad mark just because of a smallmistake. When I went to the lector and wanted to talk about that,he did not listen to me but sent me away.",3,2427
I had thrown with the ashtray a still lighted cigarette in theplastic wastepaper basket. It had burnt out and my landlords mademe a row that I might had set their flat on fire.,5,2428
"I promised my friends that I would take care of something, but Ikept forgetting about it.When they asked me about it, Ipromised to do it immediately.However, I got started only aftera couple of months.I felt that I had betrayed my friends.",5,2429
When they told me that I had been admitted to the faculty ofmedicine.,4,2430
When my son omits to carry out certain duties at home that heknows needs doing.,3,2431
Made a misjudgement in a football match.,5,2432
Forgot to do some shopping that I had promised to do.,6,2433
The sadistinc exacution of a student in the USA.,2,2434
"My brother had bowel obstruction, having heard that he was goingfor surgery, I was afraid he might not come back to life afterhearing of the General Anaesthesia.",0,2435
When I found out my roommate had been talking behind my backabout very personal things.,6,2436
Failing examn.,1,2437
"When in grade 3, late home from school every day for weeksbecause of harassment from a grade 7 boy I lied to mother aboutwhy I was home late.",5,2438
"A railways officer, when asked by the ticket checker to producehis tickets, got very aggressive and started abusing and usinghis authority in a very wrong way.",2,2439
"I feel disgusted at not having got aa \A\"" in yesterday's practicals of G220.""",2,2440
[ When I see that the toilet is unclean.],2,2441
I was river rafting in Nev. and our boat tipped over and I wassucked under in to some rocks and got stuck and all I could thinkwas that I was going to die. And it was so quiet under the waterit seemed like no one would care or remember.,0,2442
When I forgot a promise made to a friend of mine.,6,2443
[ Can not think of anything.],6,2444
"When I was a child, I was always afraid of my father. Just whenhe looked at me, I felt frightened.",0,2445
My trouser's zipper was open when I was at a public wedding.,3,2446
Being elected as class leader.,4,2447
"[ Never felt guilty, as I have never done anything which couldmake me feel guilty.]",5,2448
"I was looking after my cousin's little daughter; she fell down,was slightly injured and cried vociferously.",5,2449
About a dozen girls laughed at me and I was sure that there wasnothing wrong with me.,6,2450
"When at school, I threw a duster at another child and hit him inthe head. The blow caused a flesh wound and I was afraid of whatwould happen to me when the teacher found out the circumstances.",0,2451
Some time ago I promised to meet an acquaintance of mine and tocarry him some promised papers. I haven't done it until this day.Now I feel quite awkward when I meet him.,6,2452
I had promised to help out with domestic chores and I forgotabout it.,6,2453
I felt joy when my boyfriend proposed to me in marriage.,4,2454
When I excreted on the mat instead of the potty.,6,2455
Always when I meet the person I love.,4,2456
When my friend who is close to me got engaged and did not inviteme.,2,2457
I was very happy when I found out that I had passed with flyingcolours and that I had made it to the university.,4,2458
When a very dirty class-mate farted in mypresence.There was aterrible smell.,2,2459
When I go out with my friend with enough money and good sense toour favorite dancing.,4,2460
I applied for a job of GALSO counselor and I made the strongestpossible application but was denied an interview. I feltdisgusted at the system which by promoting the cause ofminorities makes employing whites lowest priority.,2,2461
"After I had had a disappointment in my private life, my friend,who studies in Vienna, came to see me spontaneously.",4,2462
"When a colleague asked me for help at work, despite the factthat he had more time to do it than I had.",3,2463
[ No response.],6,2464
When I heard that my father had passed away.,1,2465
[ During my childhood when I could not get what I wanted from mybrother/sister and parents.],3,2466
Doing unexpectedly well in an examn.,4,2467
When I realized that I had three more examinations to take.,5,2468
One day I was busy day dreaming along the road and suddenly Iheard the sound of jamming car braked behind me. I woke up frommy dreams and it was about to crash me.,0,2469
"We had come back from a programme and we were all (three girls) staying over at another girls placce.One of them startedpassing very nasty and outright bitchy remarks at me.It wasbrought on by a male colleague's compliments to me, this girl washerself interested in this guy.Bitchiness and catty remarksmade by women never fail to disgust me.I can particularlyremember this incident as she knew that I had not encouraged the guy.",2,2470
When the week for Exams came. I got afraid as to how I wouldtackle the questions.,0,2471
I was pregnant and thought that by not having the baby I wouldhurt the father like he did me regardless of the life we hadcreated.,5,2472
I woke up in the middle of the night as I had jumped and shoutedwith fear.I thought that someone's cold hand or somethingsimilar had touched my hand.I crept down under the covers andwent back to sleep.,0,2473
When I fought with my friends.,5,2474
I felt disgusted when a fellow student asked me to marry him.Ihad not expected this from him as he was a mere friend.,2,2475
I felt this emotion when my name was announced on the radio thatI had been selected to come to Lilongwe School for HealthSciences to take a training course as a Medical Assistat.,4,2476
"Before getting back the results of a test in school, when I hadworked very hard and was worried about not succeeding.",0,2477
"A few days after I had finished the relationship with myboyfriend, we had a quarrel. Then he hit me. At that moment Ifound him disgusting.",2,2478
I had fixed a meeting with my classmates and I missed it as I wastired.Besides everyone at the meeting was a stranger to me andI did not want to make friends with them.Whatever the reasons - I felt guilty.,5,2479
"Passing (by car) over a bridge where only one car could pass. Therewas a precipice on both sides, no protection grilles, and thebridge was completely muddled.",0,2480
At a carneval-party I smooched with a man - some days later I wasrather ashamed for that.,6,2481
"When I got an unexpected letter froma guy, who had been my schoolmate.",4,2482
"I am the secretary of an association, and during the last meetingI forgot to take the minutes.",5,2483
"My friend got married and went abroad, this made me feel sad andlonely.",1,2484
"While he was drunk, my life partner tried to hit me.I feltscared and fled to the bathroom.",0,2485
When a friend of mine told me that he was going to commitsuicide.,1,2486
"When I am alone at night after having read horror stories, andthen I heard unexplainable noises.",0,2487
When I talked maliciously about a colleague at work to someoneelse.Immediately afterwards I felt ashamed.,6,2488
"I was in the Korean War. We were attacked with mortars, me andcompanion. We stopped the jeep and ran for cover. Fortunatelyneither of us was hit but we both came close to being killed.",0,2489
I won a sport contest.,4,2490
When the neighbour of a friend of mine was stabbed to death bythieves in Kabwe.They stole his van.,1,2491
When I was in the canteen of the United college I mistook astranger for a classmate as I was not wearing my glasses.Irealized that I had made this mistake when I saw him againcarefully.,6,2492
Finding out that a boy I do not like is in love with me.,0,2493
"My boyfriend's mother, whom I had not met earlier, made anunexpected visit.I was lying lazily on the bed, reading anewspaper and my boyfriend was studying.",6,2494
"After a quarrel with my mother in which matters were \inflated\"" enormously.""",5,2495
"Just before I started my study I had to move, I was very afraidto be left alone and that I could not manage it.",0,2496
"I had been living in an overseas city and made the decision toleave the city and come home about 12 months before I met a wholenew set of friends, leaving them at the airport was sad andtraumatic as they had helped me in many ways and I knew Iwouldn't see many of them again.",1,2497
"When my friend failed an exam by just one mark.During this examshe had asked me to show her my answer sheet and I had not doneit.When the results came out, I thought that had I shown her myanswer sheet she would have passed the exam.I felt guilty as Ihad failed her.",5,2498
When I had achieved a goal indirectly. I work for CAL Footballand our 2nd win of the season was very gratifying and broughtour joy because of the hard work involved and the fact that noone expected we would win.,4,2499
When I committed a sin mentioned in ANGER. A sin of sexualimmorality.,2,2500
I passed an exam which I thought I had failed.,4,2501
I was angry with a person who behaved terribly at a balloffending her relatives.,3,2502
It was in 1983 September when MCE results were being announced onthe radio. When I heard my name that I had done well I just keptquiet. I was so happy that I couldn't even talk.,4,2503
I don't remember about a situation when I have experienced thisfeeling. Maybe it was when I saw a drunkard in the street.,2,2504
Not finishing homework in time.,5,2505
The day that my boyfriend appeared at home with a pair of ringsfor our wedding.,4,2506
"I was working in a job in which I could not work quickly enough,and was told that my work was not up to standard.",6,2507
When my grandparents moved to another part of the town.,1,2508
"I detested my father who was a drunkard.He would rave,threaten and blame my mother and me.He finally drove us awayfrom home.",2,2509
"Having failed to help with the 5th of March arrangements (Women'sDay), although I had previously promised to take part in thework.",5,2510
My grandfather died thirteen years ago.,1,2511
Guilt - because I had not written to my sister for months beforeshe died.,5,2512
When I had to plunge in a swamp of fetid and stagnant water.,2,2513
When my brother (5th in the family) passed away.,1,2514
When I learned that several people had died in the street due to the cold weather.,3,2515
Alone in the house (late 8pm) I heard noises. Sounded like someonewas trying to get in our back door.,0,2516
When I first saw the state of a cafeteria in the grounds of theuniversity. Due to students own lack of concern for theenvironment in which they eat and drink. Rubbish and spilled teaand coffee left everywhere.,2,2517
"A friend of mine was drunk and having an argument on the streetwith a woman, appparently his girlfriend.I was walking on theother side of the street and thought that I was not supposed tointerfere.Later I heard that he had shot himself that evening.",5,2518
When my daughter was born.,4,2519
When my best friend started getting involved in my privateaffairs.,2,2520
"[ Generally, when I am late in attending to matters (for examplepaying bills).]",6,2521
During the short period of my unemployment about six years back.,3,2522
Mugged while on holiday in the U.S.A.,0,2523
[ No response.],1,2524
"I do not have accomodation on the campus so I stay with myextended family, one young man used bad words while asking me toleave their home.",6,2525
"I was out with a friend in a place where it was very, very busy.When we wanted to go I bumped a person, who dropped his glassbeer I offered a new one but he didn't accept it.",5,2526
Before the department meeting my friend ate a dish that I hadprepared for this meeting.,3,2527
Finding out that some students are getting good reports they donot deserve.,2,2528
I was late meeting someone for an appointment.,5,2529
"Put down by my father - at a family outing at mutual familyfriends dinner. Told \Not to Speak\"". The attitude by him was negative/I was in mid 20s, I had done many things - a wide range of experiences. Probably greater than he.""",6,2530
Not finishing my duty as a class leader.,6,2531
The same for guilt would apply.,6,2532
I overturned in a canoe a few years back and I didn't know how toswim. Although I had a life-jacket on I still panicked.,0,2533
"I tried my level best to care for my client, I took anappointment with a doctor and before meeting the doctor heexpired - a poor small boy from Uttar Pradesh.",1,2534
"One night,when I was in primary 5 or 6, I felt thirsty so Ifetched the thermos to pour a cup of water for myself.Then Isaw my brother lowering his head and I, jokingly, poured thewater on his head.",5,2535
"I stayed at home for a period because I felt depressive and Ineglected my study when people adked me, I told them that I hadfreeterm and studied hard. I felt ashamed for my behavior andlies.",6,2536
Dead rat in the kitchen of the university.,2,2537
"While doing some calculation exercises, I neglected a part of it,though I had marked it as done.By chance, I was asked todemonstrate this very part on the blackboard.",5,2538
"Receiving notification that I had made a successful applicationto the Speech Therapy course at Uni, gave me a very good feeligof achievment and joy.",4,2539
"I live outside Graz - so I have to go by bus. One day I went homefrom the bus stop alone. It was dark, I had to go through aforest and there was a dark figure behind me. I was veryfrightened.",0,2540
I called off a relationship with one girl so I could see another.,5,2541
When my boyfriend told me that it would be difficult for him tomarry me.,3,2542
"When I began to read a thick book, which I had a limited time toread.Also when I have a lot of work to do and I cannot keep up.",1,2543
"I work at a day care centre, and one day when the children wereoutdoors a four-year old boy disappeared from the yard.I wasnot looking after them then, but as the manager it was me who wasresponsible.",0,2544
"I had never made a malicious joke in front of my boyfriend. Lastweek I did it I was funny, he loved it, and I died of shame.",6,2545
"When I lost my father on the 25th of September,1970.He died ofa sore on the leg.",1,2546
"When I was substituted in a play which was to be staged, after Ihad learnt all the lines.",2,2547
"Once, when I was ten, I could not remember why my mother was soangry.She fainted suddenly and I was very scared as I did notknow what to do .",0,2548
Lost my girl-friend.,1,2549
I have a fobic anxiety for elevators. This anxiety is worst atthe moment when the doors have to open. I have it often in theelevator at our university.,0,2550
I went out dancing and found my boyfriend kissing another girl.,3,2551
When a good friend of me told me one evening that she didn't wantto live anymore.,0,2552
When I heard that my Uncle had passed away in a road trafficaccident.,1,2553
When I was left alone at home one night by my brother.,0,2554
We were riding in a friend's car.He was driving very fast andsuddenly a another car crossed the road in front of us.Myfriend had to turn the car rapidly.,0,2555
Once I had to clean a lavatory which was obstructed.It was in afriend's country house and there was nobody there to help me.,2,2556
[ No response.],5,2557
"When I tried to put up a tent some years ago, I was teased andhindered by my cousin.",3,2558
I told a lie about someone to someone else and they found outand questioned me about it.,6,2559
I feel ashamed when I act dishonestly toward somebody.,6,2560
I was dominated by a certain person and even though I knew it Icould not change my own reactions.,2,2561
"When I was hungry, I tried to take the money that my motherhad saved up for something else.",6,2562
When I offended my parents without wanting it.,5,2563
I got a very nasty electrical shock when I was tampering withsome electrical applainces. ,0,2564
