text,label,idx
Whenever I think of enrolling in Organic Chemistry.,0,3426
At the end of my senior yr. in high school I found out that afriend of mine I knew had cancer had been diagnosed as terminallyill.,1,3427
I had gone for a medical check-up at the U.T.H and failed to makeit back on time for the C119 practical sessions at 1400 hourslast academic year.,0,3428
When I had not been accepted to a college which I dreamed ofgoing to. I felt that I had let myself and my parents down.,6,3429
"The same as in \shame\"".""",5,3430
"A gathering of a social sports club at which they proceeded toshow pornographic videos and then afterwards (when most peoplehad had quite a bit to drink) carried on in a very degrading,unmoral manner - especially females exposing and flauntingthemselves with no shame or embarassment.",2,3431
[ I have felt shame but am unable to remember any particularincident.],6,3432
"I found a human \treasure\"" that I desired and got immediately. I didn't think about anything. When I touched him I imploded but I am whole.""",4,3433
"I was very startled when, at night at 2.00 am, a boy approachedme and yelled \I fuck you\"", then however he stopped and laughed at me.""",0,3434
"When finally I found a place to live, I felt relieved, predictingchanges in my life, and I became happy.",4,3435
"I had a discussion with my wife about an over-weight acquaintance ofour's, about her eating habits and the scars caused by herpregnancy.",2,3436
When I caused much pain and sorrow to my boyfriend by finishingour relationship.,1,3437
I was crossing the street together with some colleagues of minewhen I suddenly found myself almost under the wheels of a truck.,0,3438
My father died unexpectedly at the age of 53 years. He certainlywould have liked to live longer. I was also said because I wasconfronted with the fact that I would die one day too.,1,3439
[ No response.],1,3440
"I went to visit Montrose home for crippled children to interviewa handicapped child. I interviewed two boys and it went reallywell. I promised I would visit them, but never got the time. Now Ihope they've forgotten me, but I feel ashamed of letting themdown.",6,3441
I studied medicine for several semesters. I was always disgustedwhen we had the dissecting-course. I cannot understand why somepersons like this course.,2,3442
"After a footballmatch I went home by car, a friend drove. I didnot realize that he was drunk until we were in the car. He wasmadly racing. Several times we were in dangerous situations and Itold him to be cautious, but he did not care.",0,3443
When I climbed up a tree to pick apples.The angle of the ladderI was on did not enable me to get high enough.This impliedthat the ladder was not very stable.,0,3444
Sometime back I was coming from the wards and lice were all overmy uniform since patient's blankets have a lot of lice. Ithappened that my boyfriend picked some lice from my white uniform.I was so ashamed.,6,3445
I read a newspaper article about dogs being stolen in order touse them for fighting purposes.,2,3446
"A friend and a girlfriend went to Rome for 10 days with theirclass. When they were back home I heard people tell \strange\"" stories about my friend and that girlfriend.""",2,3447
Waiting for my girlfriend to come from her apt. to mine. She wasvery late and I thought something awful had happened.,0,3448
Had fear of losing husband.,0,3449
When I was confronted by a policeman one night around 11 o'clock. I was afraid when they threatened to take me and my girl to thegallows.,0,3450
A friend was assaulted by a young man on her way home.,2,3451
That afternoon I rushed home to look at the result slip of thehigher level as fast as possible.I opened the envelope verycarefully and found that my results were much better than Ihad expected and thus I could enter the Chinese university.Mydiligence had paid and I was very happy.,4,3452
Being stopped by the police for a traffic offence which I don'tthink I committed.,3,3453
"\Boy, you have been admitted to the medicine school and your uncle is coming back fron Canada next week,\"" my father told me and it was a happy moment.""",4,3454
When I failed the twelveth standard exams I was ashamed athaving to see my parents later.,6,3455
I felt anger against a colleague of mine during a rehearsal inacting. He hadn't learnt the text of an opera act in the course ofseveral months and thus making difficulties for the rest of mycolleagues.,3,3456
"The fact that my mother is getting married again (my mother andfather divorced about 15 years ago) means that she will probablymove to Turku, and our home, which is a one family house, will besold (I myself have not been living at home for the past sixyears).",1,3457
"When my husband lied to me, tricked me and when I had to leave myhome.",1,3458
When I saw several people washing their car with water from adrain.,2,3459
Not being able to have a party at home with friends.,6,3460
"When I heard about the death of Frantois Truffaut, the French motion picture director, on the radio.I had planned to go and see hislast film.",1,3461
Once I had to visit a rather special person.,6,3462
When I passed the university entrance exam.,4,3463
"In the holiday cottage of our association, two of my pals came towake me up early one morning by bringing a radio played at thehighest volume into my room - it was the morning service at itsloudest.",3,3464
Selling the appartment after my divorce.,5,3465
When I saw a big spider from very close.,2,3466
When I watched a film about the problems of abandoned children(PIXOTE).,2,3467
I felt guilty after stealing a cookery book from my colleagues.,5,3468
"When I saw a woman who had been run over by a train, just offKafue.The woman had been cut to bits, there was blood and splinters of bone every where.",2,3469
"A fellow player, quite unexpectedly, scores a goal, which means adraw.",4,3470
"When I was accused of having impregnated someone's daughter, itwas the girl's cousin who had done it. ",2,3471
A woman I know is slowly dying from cancer. Observing thisprocess makes me sad.,1,3472
When I came home late one day. I was afraid I would be shouted atby my parents.,0,3473
I was on this amusement park ride at Marriots Great America. Itwent way up in the air and then around and around. Heights arenot my favorite spots in life.,0,3474
On a dark night I felt that there were several people near meand I did not know who they were.,0,3475
Walking on a dark street with noone around.,0,3476
I removed an article of clothing belonging to my employer whilein a position of trust.,5,3477
A close person lied to me.,3,3478
My grandfather had lung-cancer and was being nursed athome.I felt fear when I was alone with him and he almost chokedon mucus secretions.,0,3479
When I was robbed in a bus.,3,3480
It was in March 1985 when one of my fellow students borrowed mywristwatch and after sometime he broke a glass of that watch Igot angry when he was telling me but the anger didn't take longto fade.,3,3481
I was very angry at my father when he didn't give me as muchmoney as my brother to use for studying. Once again my brotherwas better off then me.,3,3482
My little brother was arrested by the police at the railway station afterhe had drunk some beer.,6,3483
"When I found out that a set task (i.e. 2 essays and a test), thethought of which had oppressed me, were not on the date I hadthought.",4,3484
When I passed the grade 7 exam.,4,3485
When my grandmother died very suddenly without warning.,1,3486
Years ago I fell in love for the first time. as natural for everyschool-girl I was day-dreaming. Later (after 3 years) we lefteach other. No one was to blame but I felt deep sadness. Even nowI remember about it quite often.,1,3487
"I was walking in the wood at night with my boyfriend. Veryromantic. Suddenly I heard a car driving very slowly with thelights out, it looked as if they were looking for something.",0,3488
A man in a car was following me when I went running early onemorning in a fairly secluded area.,0,3489
When I had to walk along a dark road alone.,0,3490
An argument among several friends because of the irrationalbehavior of one of them who fell out with us for no reason andsaid that we were to blame.,3,3491
The moment I got the news that I had been selected for the U.G.Cjunior national research fellowship.It was a dream come true.,4,3492
When I saw a male engineer one year and came back to find he wasnow a female (I don't know it/them personally).,2,3493
"Being mistreated by my former primary school teacher, Mr Zalu.",2,3494
"At work, when an elderly man complained unjustifiably about me anddistrusted me.",3,3495
"Before I moved away from home, I feared leaving.",0,3496
"I was happy when at difficult times I could find support in myfriend and my fiancT, I was happy because of their spiritual andmoral help which gave me new power to struggle. I was happy then,I felt it in my soul.",4,3497
Being miserable in a party when other people are friendly andhappy.,5,3498
"When I travelled all the way to my former school to collect mycertificate, only to be told that I owed them some money, I knewnothing about this.",3,3499
"When I was talking to a person who is a hypocrite, I feltdisgusted at his reaction.",2,3500
[ No response.],2,3501
A colleague asked me for some advice and as he did not haveenough confidence in me he asked a third person.,3,3502
"When I was a child, one day while playing, I fell up to my waistin mud.",2,3503
When my little sister was sick at home and I thought that shewould die.,0,3504
"The sense of guilt came over me too, when I interrupted mystudies. Why ? Because I felt guilty before my parents ! Theybelieved in me though this event did not make them disbelieve me.",5,3505
"The day the results of the university entrance exam waspublished, I found my canditate number and I was very excited.",4,3506
After an event in which I felt that I had acted unfairly.,6,3507
Getting slightly intoxicated at the 1984 I.C.C. Ball.,6,3508
I walked in on a teenage patient of mine (I work in a hospital)as he was going through my office drawers and he had removedmoney from my purse.,3,3509
When I get home late my father scolds me and this makes me angry.,3,3510
Getting sent on a company expense trip to another state to workfor a week at that plan.,4,3511
Haven't felt shame for ages.,6,3512
"Talkiing about the past happy hours with two friends at night ina camp a few months ago.We shared our feelings, notions andevery hidden anxiety.I thought that they cared for me and Iwas very happy and satified.",4,3513
"When I took a car which was not mine, and suddenly it stoppedworking.",5,3514
"When I was 8 years old my tonsils had to be operated on. This isnot a complicated operation, but just before it started I wasvery afraid so that I will never forget it.",0,3515
"In 1983 a sadist provoked my sister in my presence.He triedto force my sister into accompanying him to his place, but mysister did not agree and so she was kicked and she fell down. There was a fight.",3,3516
After passing my Malawi Certificate of Education Exam and beingselected to Kamuzu College of Nursing.,4,3517
"One evening, in the tramway, I was afraid of two drunk menmolesting my girlfriend and me.",0,3518
A friend told me about his cousin who is my girlfriend. He saidshe had treated him in a mean and nasty way. I was surprisedbecause in front of other people she had always treated him in afriendly way. I am very sad about it.,1,3519
I saw a film about the nazi concentration camps during the war.After the film I felt disgust.,2,3520
"My father won't be so pleased with me as if I was elected \Three Good\"".""",1,3521
"I feel shame when I have made a promise, I can't keep it and thishas negative effects which are caused by my behavior.",6,3522
Caught cheating on a diet.,6,3523
When my boyfriend and I experience something nice or when we havemade a nice walk together.,4,3524
"When I knew that a person who I didn't like, had about me otherfeelings.",2,3525
When money was stolen from my pocket.,6,3526
A friend told me how he managed to win the sympathy of as manypeople as possible. He said he first listened to what they saidand then he tried to only say things they would like to hear.He would never express his own opinion. I felt really disgustedwhen he told that.,2,3527
Not being chosen for the English lectures (my girl-friendchosen).,1,3528
"While watching a movie, someone who was drunk started vomitinghelplessly.",2,3529
"When I was doing my last year at Secondary School I was robbed ofmy clothes, wristwatch and my pair of shoes. After investigationsit was found that all the things were stolen by one of the boysin our hostel.",3,3530
"I stormed into the room, hoping to cool myself with some softmusic from my three band radio cassette.There was only youngKaley there and he explained, \ Your aunt has sold it as she wanted to buy clothes.\""""",2,3531
When I decided not to out any longer with a girl whom I likedquite a lot.This made me feel low for a some time.,6,3532
When I had stayed abroad for a long time and I had rememberedabout my friends and relatives. I felt sad and I wanted to seethem as soon as possible.,1,3533
Winning a game after a long time of losing.,4,3534
"I had arranged to meet my friends at a certain place, and I waswith other people.My friends did not arrive and the people whowere with me began to get tired.My friends were one hour late.",5,3535
My friend had trouble and I was not able to help him.,5,3536
"A few years ago my mother suffered from canccer and died withintwo years.We had not finished our studies then and could notbear our responsibilities as her children.My mother had triedher best to take care of us but she lived in pain these twoyears.Neither the doctor nor we could do anything for her ascancer is incurable.I was very eager to replace her insuffernig , even die instead of her.",1,3537
"When I stepped on a snake at home, it was dark but there wasmoonlight.",0,3538
"When I accused unjustly a person of robbery, who proved me thecontrary, almost caused a public fight.",6,3539
When I walked out of my room with only my pants on and found mygirlfriend and her female friend looking for me outside.,6,3540
When I found one of my new pullovers wrinkled inside thewardrobe.My brother had done it.,3,3541
When I imitated a teacher behind his back - walking very silly.,6,3542
"When I was dismissed unjustly from the firm where I worked,because there where persons that didn't have problems, andwouldn't miss in the jobs they occupied if they were dismissed.",3,3543
"A friend told me it would be better for me not to be on familiarterms with another friend, although, in my opinion he had noreason to say such things. He only said so hoping that Iwould search support from him (that, however, was not necessary).",3,3544
"One day, I discussed a very important question with A.Asuddenly declared that he would not accept my position andthought that he himself was right.Moreover, he attacked strongly, not my opinion but me personally.",3,3545
"During the PY 102 film session on Tuesday, one of the films shown was of an experiment on a live cat involving strapping it into amachine for possibly days, and doing things to its brain.",2,3546
I thought him a good friend but he tried to lie to me several times.Last time was the height of impudence. He promised he would comehome but he didn't. I felt a sense of anger and insult.,3,3547
I was very happy when my scholarship to continue studying at UNZAwas approved after it had been cancelled.,4,3548
"When I was 15 my mother discovered various items in my room which15 year olds aren't usually expected to have - mainly alcohol,marijuana and contraceptives !",6,3549
When I got the scholarship I was very happy as the finacialburden of the family was reduced.,4,3550
"After one year of searching, my friend and I have found a flat weare able to pay for.",4,3551
When I failed Psychology examination when most of the studentspassed.,6,3552
My dear hamster (called Hannes) died at the age of 2 and 1/2 years.His shape forced me to mercy killing (an injection).,1,3553
I had an interview for entry into college. The results were to beannounced on radio. After a long period of waiting the resultswere released. I had succeded - tension was relieved by joy.,4,3554
"The same event described under FEAR - in the bus a man sat besideme, with his trousers open and holding his penis.",2,3555
I was unaware that I had walked the streets in torn trousers.,6,3556
When I got to know that my father had passed away.,1,3557
"When my uncle found me having sexual intercourse with a distantrelative of mine in the sitting room, on the couch.I failed tostop and get up, I carried on.",5,3558
"I was supposed to fetch some friends at the bus stop, but I didnot do it because my father was in a bad mood and I was afraidthat he would grumble.",5,3559
Stranded in the north of Fraser Island with a submerged 4 WD hirevehicle.,0,3560
"When I was involved in a car accident last November, after thefirst fall of snow.I lost control of the car and it spun roundand landed on the opposite side of the road, on the hardshoulder.It was stopped by a pole on top of a bank sloping downto a stream.",0,3561
When I saw my niece (5 yrs) crying in the hallway for her motherwho had passed away about a month ago.,1,3562
"That day I was alone at home after coming home from school.I didnot know where everyone else had gone, I kept waiting for them tocome back and nobody came.It was getting very late and I wasterrified.",0,3563
"When I saw the list of books to read for an acccouting course, Ithought \ Oh God how will I ever manaage it!\""""",1,3564
Failing an examn because I did not work hard enough.,6,3565
I was disgusted to find out that the water isn't filtered orpurified before it leaves Latimer Hall from the drains.,2,3566
Somebody told her friend that she would hit me wherever we wouldmeet.,0,3567
At a moment of affect I offended a person very close to me. Hehad given me ground for that but it was a trifling in comparisonwith the way I insulted him. A moment later I felt a sense ofguilt.,5,3568
"When I finally managed to get a specific sound from my guitar,after baving tried for a long time.",4,3569
"After waiting impatiently for the results of the form 5examinations for almost a year, at last I received a letter ofacceptance from the Senate of the university of Zambia tellingme that I had made it to the first year course at UNZA.",4,3570
I came home and discovered that someone had broken in. Then Irealized that they probably were still there.,0,3571
My friends and I were sitting at a restaurant. We were talkingand a few of them said awful things about women. I becamedisgusted by their narrow-mindedness.,2,3572
It was when I was selected to go to a Secondary school to startform I.,4,3573
A party with friends on New Year's Eve.,4,3574
"A drunken friend of mine was beating up another friend, who wasalso drunk.",3,3575
Being sexually assulted on a bus and noone helped (people onlylaughed).,3,3576
"When I was in a bus on my way to the examination centre, a man sitting opposite me kept looking at me continously. I did not know what was wrong.When I reached the centre I started strolling around as I still had a little time.Suddenly a man came and whispered \You have forgotten to zip up your trousers.\""I was at a loss to say anything and I felt very embarrassed.When I thought of the bus incident I felt even more ashamed.""",6,3577
I lied to a friend.,6,3578
Some days ago I had a slight car accident through my fault.,5,3579
When the parents of my girlfriend gave permission to spend ourholiday together.,4,3580
"After having watched a crime show on the TV, I was about to takethe dog for a walk. Then, suddenly, there was a man on theporch... (We live some distance away from other people).",0,3581
"Accidentally dropped a friends camera flash, so that it wasbroken.",5,3582
Teacher suspected me stealing money.,6,3583
"People who came to our home - and requested \Put out your smoke\"". That we should not smoke in our house... and asked not even politely. It disgusted me because I think people need to adapt to the situation.""",2,3584
Finding out my grades at the end of my Sophomore year.,2,3585
My got my mathematics test's marks and could not believe that itwas true.In the past I would have at least 80% marks.Was Igetting weaker at studies ?This made me feel that I should notexpect too much from going to the university.,1,3586
Motor failure on a boat outside Gottenburg when we were in heavy seas and the wind was strong.As we could not steer the boat wedrifted towards the rocks.We did not succeed in attracting theattention of any passerby until 4 hours had elapsed.,0,3587
First time in anatomy.,0,3588
"When I understood that my marriage was falling apart, and wedecided to be legally separated.",1,3589
Failed to do what I had promised.,5,3590
When I came to know that my feelings for someone were notreciprocated.,1,3591
When I was in the puberty I smashed the favourite toy of mylittle brother because of a fit of rage.,5,3592
"Someone told me a story of Amnesty International: a boy waskilled and his head was put in the litter of his girlfriend. Itlooked as if she was pregnant, then she died. It is disgusting, Ican hardly write it down.",2,3593
"This summer I got into a fight with one of our patrons (at atheatre). He hit me and I hit him and her friend, he hit my friendand we all hit eachother.",3,3594
When I think about my parents getting old.,1,3595
A drunk man had fallen in the street and he was shouting obscenewords.,2,3596
"When I was refused a transfer from my school to another, simplybecause it was far away from my house.",2,3597
"I experienced this feeling when I was accepted as a student.Because everything turned out different from my expectations.Although I passed the exam successfully I was accepted as astudent only when I didn't expect it at all, namely at thebeginning of September.",4,3598
I was furious when the teacher pointed out in class that Iwas the quietest girl in class.,3,3599
At a social event when none of the guests would help to servefood or clear tables. It was all beneath them.,2,3600
A few days ago I saw two dandy girls of my age. I disliked theirclothes and their way of doing.,2,3601
Close friends talking badly of other friends.,2,3602
One day I went for a bath. I took off my clothes and as soon as Ihad finished my brother came in. I felt sad and I found no reasonwhy he came in.,6,3603
"When, for example, I left for the first time my parents and Iwent to live in Sofia.",1,3604
Once I did not have enough money to pay for a coffee.,6,3605
When my nephew asked me to tell him a story and I simply did nothave the energy or the will.When I saw his disappointment I wasterribly guilty and read a story to him after all.,5,3606
When I arrived home late at night.I know that my mother getsworried and this made me feel angry.,5,3607
I felt it at the same time when I felt disgust.,0,3608
When I forgot the lyrics during a song contest.,1,3609
"When I meet old past pupils of mine - and find they are all doingwell - I feel joy. Yesterday I met a young woman (20 yrs) I'dtaught her at 6 yrs, then at 12 yrs and hadn't seen her for last3-4 yrs; she was no longer a waitress but a meter maid forCouncil.",4,3610
"My mother died of cancer after a 4 year illness - I think themost pregnant moment of sadness was the next morning, just as thesun rose.",1,3611
"When I was in the army, a room mate of mine came back fromfurlough and threatened another fellow with a knife.",0,3612
When my brother gave me a watch.,4,3613
"When I think of death - not my own but that of my parents,brothers and sisters.",0,3614
I was playing a sport in an advanced PE class and many of thepeople were not advanced.,2,3615
When my kid brother broke my reading spectacles.,3,3616
"One morning I was standing at the bus-stop and the bus passed bywithout stopping, even though there were only 8-10 passengersinside.I felt angry at the rude behaviour of the bus driver and conductor.",3,3617
When I came back from my holidays.,1,3618
I once caught a letter in my girlfriend's handbag from a certainman. I felt anger.,3,3619
When I was the South Koreans on the TV.,2,3620
I drink wine too often.,6,3621
When my father failed to send me transport money after theclosure of the school.,3,3622
When in the end of a semester I got the approval in a matter thatI judged very difficult.,4,3623
When I as a child of 9 or 10 I was playing doctor with theneighbours boys their mother caught us.,6,3624
Introducing myself at a first tutorial this year at University.,0,3625
When I thought the house was on fire at night.,0,3626
"I studied medicine for several semesters and at that time Ideveloped a great fear of examinations. I was most afraid of myexamination of anatomy. While other students were examined, I wasdissecting. I was able to hear everything and was waiting withfear until it was my turn.",0,3627
Not thanking relatives for a favor done.,5,3628
"When after 10 months of national service I was \downgraded\"" anddid not have to do the remaining 5 months.""",4,3629
"I was annoyed when a person higher up asked me why a particularjob was not done, it was not my job to do it.",3,3630
When I saw my family after a separation of one year.,4,3631
I mangled the side of my dad's van on a fence. I did not realizethe extent of the damage until he showed it to me the next day.The shock on my face was genuine so a friend interceded with agood excuse which I did not deny. I never clarified thesituation.,5,3632
My mother wants to talk very often about her life. I dislike thisbecause she always talks negatively about the same peoplewhatever I do it doesn't help.,5,3633
