text,label,idx
When I failed my grade 7 exam at the first attempt in 1975.Myfather and the entire family thought that I was finished in life. I really felt like hiding.,6,0
At primary school I was accused by some boys of being in lovewith a certain girl in their class so they had to shout and beatthe girl and the matter was reported to the headmaster.,0,1
"One of my friends kept criticizing me about everything I did. Ithought she was kidding, but later I found out that she wasserious.",3,2
"I feel this emotion very often when I try to express my feelingsin public, because other people do not understand my reactionsand think that I am silly. ",6,3
"One of my best friends accused me of giving up to early onproblems. It was only a casual remark on her side, but I wasangry and hurt.",3,4
"It was a complex situation concerning a relationship with aboyfriend, I had broken the relationship for some reasons.Meanwhile, as I felt it, I had most sorrow.",1,5
A drunken man forced me to kiss him.,2,6
Saw some girls dressed up like Americans,2,7
"Guilt at having pressed another person to expose/explore hispersonal weaknesses/faults, to the extent that the other personwas made to feel terrible/defensive.",5,8
When I drove to Stockholm for the first time and drove off theStora Hissingen road at the wrong exit.,0,9
"When I was in Form 4, at Secondary School, I was elected as aschool Library Assistant and also the leader of CatholicStudents, so I felt very joyous.",4,10
I helped someone to do something and was found out.,0,11
I had stolen a bottle of rum from a person who knows me well. Hethreatened to call the police if I did not pay 500 Shillings.,3,12
"A friend of mine uses butter instead of oil when he is cooking. Iam always angry about that, because it is an unnecessary luxury.Recently we both were cooking and he wanted to use butter again.When I had already put the oil into the pan, he poured it outagain and put the butter into the pan.",3,13
The day my teacher of Latin and French died.,1,14
After my girl and I talked things over our relationship changedand became positive.A diificult time turned into pleasant one.,4,15
Nearly caught masturbating.,6,16
"I cut a friend's hair in anger, without any consideration.",5,17
When I am out in the dark and a suspicious looking charactercomes towards me.,0,18
"I was coming back home with my mother when the purse I wascarrying got stolen.It was done so swifty that I did notrealize what had happened till much later.A lot of money and thekeys of the house were lost.I was guilt ridden at mycarelessness.I felt terrible as I do not normally loose thingsand this was quite important, especially the keys. ",5,19
"I had asked the teacher to write a recommendation letter for me,but I had not provided enough information and had run short oftime.",1,20
"I had something wrong, saying wrong things and being impolite tosomeone, and this had embarrassed the this person.And Istill meet the person.",6,21
When my neighbour's house was broken into and shots could beheard.,0,22
I arrived an hour late for an important meeting ( I hadmisunderstood the time).,5,23
When a friend tried to back bite me on false grounds.This mademe wonder if he was a really a good friend.,3,24
I bet that I would jump down from a window. I was sure that Iwould jump but before I did it I rather felt fear.,0,25
Bad temper of the serving lady in the students' dining hall.,2,26
I have done the teachers training course (B.Ed).During ourtraining I was asked to handle the ninth standard class in a boysschool.I was scared to face the class the first day.,0,27
A friend breaking up with her boyfriend.,1,28
"During lunch with some classmates, a priest was also there.Hewas eating desperately as if someone was going to take his plateaway.He did it with gluttony.He wiped his hands on his suitseveral times and it was full of crumbs.",2,29
I felt disgusted about a teacher who had rejected all that washuman in her. She refused to accept the flowers we gave her forthe eighth of March and asked for a foreign parfume instead.,2,30
Not having good marks like other people for homeworks.,6,31
[ When excuses are necessary and I get out of doing it myself.],5,32
My roommate talking and shaking her bed at night.,2,33
When I realized that it was impossible for me to be as free as Ihad imagined and that I could not do anythong about it.,1,34
I didn't do very well on a midterm and I'm disgusted with myselfbecause I was prepared and thought I did well.,2,35
Overhear people talking about me and saying that I am stupid.,3,36
Forgetting an important appointment.,6,37
I took Pharmacology books from my friend's desk withoutpermission and I was found guilty.,5,38
When I learnt that my brother-in-law had been poisoned by hisfriends and that he was dead.,1,39
I was on my way home when suddenly Gule Wamkulu came from thebush and blocked the road. I was in fear and didn't know what todo.,0,40
A condition in which I was disgusted followed when I lost moneyon my way home from the college.,2,41
Brother provoked anger. It was when mother and father were awayand we had to look after ourselves. He accused me of beingselfish and a snob.,3,42
I was at home alone and my mother had asked me to heat the house.I put too much fuel into the stove. It began to glow and therewas a noise in the whole house as if it was going to explode.,0,43
When I was on holiday someone vomited in front of me.,2,44
I had too much homework and examinations and I did not know howto organize my work.,3,45
Once while studying for my exam I found so many complicated wordsthat it disgusted me.,2,46
"A person with whom I had been on bad terms, gave me a present. Webecame reconciled.",4,47
Finding out that I was deceived by a friend.,3,48
"My girlfriend one day went out and promised to be back at 6.00 pmhowever she first arrived at 10.00 pm, without a message (we hadto go out that evening).",3,49
[ When my performance (homework or other work) is better than others.],4,50
When I flew out to my mother and made rude remarks because I feltso tense (studied too hard for an examination).,5,51
When I heard what mark I had got at the entrance examination andI realized my admittance to the University was almost certain.,4,52
When a girl that I liked didn't accept my curting.,2,53
When I realized that I was pregnant.I thought about what myrelatives and friends would think about me and I felt a lot ofself pity.,6,54
When I made a fool at an examination.,6,55
When I have to go in for an exam and the examinor is a personwith a whimsical character and unsteady requirements.,0,56
"I asked my friend to come with me to a disco because I wanted tobe with a person I know well. But when I amused myself withothers I let my friend sit alone, although I had asked her tocome.",6,57
"When I was accepted for further education, here at theuniversity.",4,58
"Last week, my organization summoned an executive meeting and oneof the executive member's pointed out a loop hole in thecommittee's administration.He could not suggest anyimprovements, so I quarrelled with him.",3,59
"I wanted to go to Bhopal for relief work (gas tragedy).My bosssimply refused to let me go, I was so angry that the only thoughtthat came to my mind was to quit the job.",3,60
I had to call someone and make an appointment for a conversation.I was very afraid to fail.,0,61
Failing an examn.,6,62
Fear came towards the end of May when the P.T.S. results were outafter hearing the failure of my fellow three friends.,0,63
The surname of my brother was different from ours.He oftengrinned at home and provoked others for the pleasure of it.Thismade me angry.,3,64
"My notes were not returned to me, it kept on beingprocrastinated.",2,65
Winning the local soccer championships this year was a great joy.,4,66
I had gone camping with my old classmates and there was a storm. We were in a flurry but at that time I felt the love and concernof my friends.,4,67
I felt joy when I red my name in the list of the approved in theentrance college examination.,4,68
When I had my four children.,4,69
When I crashed my car.,0,70
When quarreling with friends.,5,71
When I was ill and had to stay at the hospital for a period oftime.,1,72
When I heard a rumour that the 1st year exam results were out. Ihad fear that I might be one of the failures.,0,73
When my brother was selected to the University of Malawi (thePolythecnic). I was very excited and I rejoiced due to one of ourfamily members qualifying for University level at long last.,4,74
Friends calling me fat - pear shaped in front of a nice girl.,2,75
"A kitten had wandered into our office, and I was told to take itback across the street. When I crossed back, the kitten followedme and was run over and killed by a car.",5,76
When at times unconscienciously I speak to my mother in a hightome but after that I am sorry and I feel guilty.,5,77
When I heard that a good friend had committed suicide.,1,78
When my basket ball team lost the qualification at a final.,1,79
When I went out with a friend of mine to meet her ex-boyfriendwho didn't know that she was engaged to be married.,6,80
"A close acquaintance of the family died of lung cancer. Although it was expected, I still felt depressed.",1,81
"I was cold to my sister without meaning it, just because I wasupset and frustated.",5,82
When my grandmother died.,1,83
At the age of 12 (or so) I stole from a Ranger's fruit tree anapple. (And eventually was compelled to confess - Dostoerskywould like this).,5,84
Not handing in homeworks in time.,5,85
"It was at the time of my M.Sc exam, when I was not in a positionto take the exam after having studied seriously.",1,86
[ A chat on the telephone with a friend.],4,87
Cooks refused to give me food.,1,88
When I learnt that I had been betrayed by my friend.,1,89
I felt joy when I passed the worst phase in my life anddiscovered how many people considered me important to them.,4,90
"I had high-heeled shoes one time, but a certain girl who saw theshoes told me that they were out of fashion and I looked as anold man when I was in those shoes.",6,91
I arrived in Vienna in the middle of the night. I asked for somesilly information - as I realized myself afterwards - and the inquiry clerk reacted in a very arrogant manner.,3,92
I'm very disgusted when I see people abusing their body withdrugs and alcohol. They take advantage of these things usuallyfor an excuse for the fantasies which they like and so they dothings stupidly and unjustly.,2,93
When I almost drowned myself in the municipal swimming pool thatI use to go almost not excaping.,0,94
"I saw a neighbour, from the same appartment block as me, lying on the road.He could have been injured or ill.I kept 20metres away and did not go to help him.",5,95
I felt joy when I passed my Malawi School Certificate ofEducation.,4,96
Article published.,4,97
When the result of a project work was treated nonchalantlyintead of being criticized by the teacher.,1,98
Social situation - at the pub - a close friend of 2 years toldthe group around us of advances I had made.,1,99
"I was angry at my brother over an argument we had together.Wedo have a few fights from time to time, and also at times I takeout my anger on him.",3,100
"One night I could not practise my violin as my family waswatching T.V with the lights off, so I wanted to listen to sometapes.It was dark so I asked my brother to bring me a torch,however he scolded me.I was so angry that I slammed my violinon the floor.",3,101
"I had an intimate relation with my boyfriend, but unfortunatelywe had sexual problems; therefore I deceived him, but I wasashamed when I told my friend about it.",6,102
"The breaking up of a relationship.We decided that therelationship could not carry on, so it was no surprise to me.And anyhow, I had known it would happen sooner or later.",1,103
When I passed my form three exams.,4,104
When my gradmother died.I felt very sad then ... The feelingstarted to be worse after a while.,1,105
When I see all the putridness of people. The fact is the catarrhand spits that whash the streets of S.Paulo.,2,106
Getting a low grade on my physics midterm.,2,107
During my Highschool time I was chairman of the student'scomitee. In this function I once had to make a speech to a largeaudience and I was very nervous. After three sentences I forgotmy text.,6,108
"I went out with my sister, her boyfriend and his friend. I didnot like this young man. But suddenly he overcame me and kissedme. He was very strong so that I could not defend myself.",2,109
Being insulted by my roommate (she is in the English Class).,3,110
I had always been first in my class and in the preliminary boardexams I scored the highest marks.Then the exams werepostponed and I neglected my studies as I was confident.Howeverwhen the final results came out I felt ashamed as I had scoredless than 60% marks and my rank in the class was fifth or sixth.,6,111
"When I passed my driving test, as it was the fifth time that Ihad taken this test.",4,112
When the contract about my shop was signed.,4,113
I had met someone and we became good friends. Our relationshipgrew closer and now he is my boyfriend. I felt joy when I foundout how he felt about me.,4,114
When I was told that a boy did not want to be my friend withoutany apparent reason.,3,115
When my wife gave birth to a baby boy - my only son to date.,4,116
"It was my mother's birthday. My father and I used to buy apresent together. However, now I had bought something togetherwith my girlfriend and I forgot to ask my father.",5,117
When my boyfriend came form Rumphi to Lilongwe for a visit I wasvery happy to see him and couldn't believe it was him with me.,4,118
When I left my boyfriend. I found another girl at his home but hedid nothing to relieve the situation.,1,119
A grenade blew out next to me.,0,120
"Sitting in a bus, I heard behind, the voice of a girl I wasfriendly with. After her talking for some time with another girlI decided it wasn't her in fact that someone miming her, which itwas when I finally looked. I was talking to a friend at the time.",1,121
When I found out that I can travel with my best friend.,4,122
"During the funeral of my grandmother, when I saw my mother andother family members crying.",1,123
"I remember my religious experience.Duringa gospel camp, a fewfriends of mine decided to believe in God.The joy that I feltat that time was more than words can express.I blessed them andpraised God in my heart.",4,124
While walking in town I noticed how the police harrassed a manwho was under the influence of alcohol.They terrified him withthe thought of arrest by driving close behind him on a pedestrianstreet.My disgust was directed at the gestures and the facialexpressions of the policemen; they seemed to be enjoyingthemselves.,2,125
I had the window open and the door was shut so that the kittenwould not go out.My partner came in and started talking aboutsomething and I forgot about the window and suddenly I saw thekitten hanging from the window frame. I was rigid with frighttill I got hold of her.,0,126
"I went to fetch my girl-friend at the station. When the trainarrived and I saw her descending and running up to me, I feltglad.",4,127
When I came to know that a girl I was fond of already had aboyfriend.,1,128
When I was about to clean the draining board and saw it lookedunderneath the sink (I live in a students hostel).,2,129
"When my grandfather died. When I heard about his death, I had abad feeling in my stomach and I felt as if I had lost somethingvery precious.",1,130
When I saw a documentary film about World War II (about Hitlerand his adepts).,2,131
I got a job right after school was over.,4,132
"When I come home in the evening, the first thing I do is to sitdown and smoke a cigarette. One day I found the flat in a totallydesolate state. My girl-friend had wanted to tidy up but had notfinished.",3,133
"When I went to my boyfriend's house for lunch and saw hisparents, I felt that they were watching me all the time.",6,134
We were just about to go into the Exam room and I didn't see allmy writing materials plus the identification card from the placewhere I left them.,3,135
"The time when I cleaned the house and everything was tidy,then my cousin, who is 4 years old, came with a muddy pot and madea mess of the whole thing.",2,136
When someone is accused or punished instead of me.,5,137
When I got the loan for my studies.,4,138
"When my friend got very low marks in field work even though hehad worked throughout the year, I had this feeling.",2,139
When I received a letter from my girlfriend telling me that shewas engaged to an another man.,6,140
Guy I cared for went back to Canada to live.,1,141
One night a friend found out that I dumped one girl for anotherand he proceded to lecture me.,6,142
"While travelling in a bus with an invalid ticket, I got caught.",5,143
I was in a sanatorium. In front of me a boy fell down from hisinvalid's chair. I could help him but I didn't. I felt like beingparalysed.,5,144
"When my little brother passed away mysteriously, at least fromwhat I was told about it.",1,145
The curriculum of the year ! The English course was very heavy. I had not prepared and the teacher asked several questionsduring class.The students were not ready to answer thequestions and the teacher was frustated.,2,146
"This was at secondary school, a prefect framed up some case andtook it to the deputy head-master.I was called by thehead-master and he threatened to suspend me.",0,147
I put my head into the pullover of a girl to see her breasts. Thegirl looked at me so that I felt ashamed.,6,148
The loss of my mother.,1,149
"When I told a girl that I could not take her out that night as Iwas entertaining my mother who had come from home.However, Ilater met this girl with another girlfriend at a hostel where Ihad taken out another girlfriend of mine.",6,150
Marriage crises.Boredom.,1,151
Winning a rowing race at a Karapiro regatta. With 7 otherfriends.,4,152
When I first failed my standard 8 exams for the first attempt forForm I selection.,6,153
"I was rushing home from school because there was a 49er game thatnight. I got into a non-injury accident, which was all my fault,but destroyed the front of my car. The truck I hit was undamaged.",3,154
[ I speak harshly to my parents though they only mean my owngood.],5,155
I had taken the responsibility to do something and I hadprepared for it.However I failed because of my timidity.Afterthree attempts I still could not adapt to the atmosphere andfailed as before.I felt imcompetent and felt that the otherswould think that I had not prepared for it.,1,156
Saw a very arrogant girl walking like a queen.,2,157
I was angry about several drivers who showed an aggressive anddangerous driving habit.,3,158
"My illness a few years back.I was sevely down with malaria andasthma, I had lost my health, charm and cheerfulness completely.",0,159
Somebody wanted to beat my brother at a wedding ceremony and Iwas trying to protect my brother but the other man was callingnames to both of us.,3,160
"As a child, when I was at home alone, I felt in an indefinatemanner afraid of the death of my father and mother.",0,161
Nothing.,2,162
"A certain colleague of mine sent me to buy a bag of flour for him,he gave me K20. Unfortunately I lost it.",5,163
Tutorial again !A fearful feeling came to me when I sat on thechair and looked at my fellow students all around.I was reallyscared that they would ask me some questions or challenge theideas that I had presented.,0,164
Before going to the dentist.,0,165
I was living at home during the Summer vacations and towards theend decided to take some of my clothes and other belongings tothe appartment in Guttenburg.When I had finished I went to myex-boyfriend's (relationship uncertain) home and stayed theretill 5 A.M.I had to leave then as my parents needed the car forwork in the morning.My parents do not like my boyfriend.,5,166
Several years ago I was caught riding the train without a ticket.The station-mistress treated me like a criminal almost.,6,167
When my grandfather died.,1,168
"A few days back a friend of mine had asked me to call on him onSunday.I had accepted it but later did not go for no specificreason.I just slept in my room.The next day this friend called me up and told me that he had been expecting me the day before andhis wife had prepared a very good lunch for me, which had gonewaste.I felt very bad about this incident and it has beengrowing in my heart ever since.",5,169
"When I had to sleep in a bed at a hostel, which was full of dirt.",2,170
"I feel disgust at my neighbour, because she comes to our house withher child, who spoils our furniture.",2,171
When I whatched a horror film on a Friday 13th.,0,172
Heard that my girl-friend was chosen for the English lectures andI was not. I lost my temper and she is very upset now.,5,173
When my mother treats me as a 10-year old boy.,3,174
"While preparing my master's thesis, I was scared that I would notaccomplish anything as the subject was rather difficult.",0,175
Someone frightened me in the dark.,0,176
I came out of the house at 7:20 am Monday morning getting ready tgo to school and fight for a parking when I saw my car had a flattire.,3,177
When I read the newspaper that morning I found my candidaturenumber on the admission list of the Chinese university.I wassatisfied and happy and the cumulative anxiety disappeared.Ionly wanted to cry out that I had succeeded.,4,178
I saw a terrible accident happen and I laughed a lot of thefright and because I was nervous.,6,179
Felt joy a few years ago when I was away on holiday. And sat veryclose to my best friend looking straight into the eyes.,4,180
The day I left my first girlfriend.,1,181
When my beloved uncle was shot dead by relatives.,1,182
"I hadn't been at my parent's place for a long time. When I went tovisit them I had high expectations, but when I was there it wasvery different from what I expected.",1,183
I felt guilt towards my mother when I went to live on rooms inNijmegen where I study.,5,184
"New Year's Eve party in the country, I hardly knew a person; mypartner spent most of the time at the bar. I had littleopportunity to get to know people because our table was separatedand my boyfriend's parents were present.",3,185
I made a comment that at the moment didn't fit.,6,186
A teacher at my former secondary school forced my darling tomarry him.The girl tried to refuse but her parents would notleave her alone.,3,187
"I awoke at night and did not remember dreaming about antthing inparticular.I just felt oppressing fear, it was dark and all theothers were sleeping.",0,188
"When I dived among sharks and the brightly coloured fish on theouter reef of Tvavni, Fidgi.",4,189
I heard of the death of a closefriend of mine.I had gone camping with him shortly before his death and the whole thing seemed very sudden to me. ,1,190
Brother took my money to use for his own purposes.,3,191
"I was at home alone, and heard noises on the roof, and doorknobs,and drawers.",0,192
I was really shameful when my mother beat me in the presence ofmy friends because I didn't cook lunch up until 2 o'clock.,6,193
When I was accepted as a student of Psychology here atGutttenburg.,4,194
One night I had a very good conversation with two friends. I thenrealized how worthy they were for me and how happy I was tohave them as friends.,4,195
"When I found out my cousin had been killed. I was angry at theworld, and her murderer who was her ex-boyfriend. It was the worstand most hateful day of my life.",3,196
"Doctors ignored relative who complained about pain, and is nowdying of cancer.",2,197
Fear from the unknown. I felt fear when I sat for the entranceexaminations.,0,198
"When I am not able to fulfill any request of my son - can't takehim out to ride his byke, because I am tired.",5,199
"When I achieved my first 6 at University after a long string of3's, 4's and 5's (7 is the highest mark awarded, 3 is a concededpass).",4,200
When I stole something.,5,201
My mother always evokes feelings of guilt in me. For instancewhen I miss the last bus I know she will be concerned for me andstay awake till I arrive.,5,202
A friend of mine remembered me when she needed me and did noteven think about me when she did not need me.,2,203
"I was of the opinion that 12.00 pm was too early to be back athome after going out, so I stayed away longer, knowing that mymother would be worried.",5,204
Once as a child I dreamed of a fire. Since that time I hadn'twanted to sleep in that bed and had feared the night darkness(and so it is now).,0,205
"Achieving my goal at a swim meet. I worked toward the goal for 9yrs. I was capable of achieving it, but I didn't know when.",4,206
Every time I see a spider or a snake.,0,207
During 7th grade our class mobbed a famale teacher so badly thatshe had a breackdown and was hospitalized.,5,208
A brother from one of the Christian fellowship often phoned meand talked to me for half an hour or more.However there wasnothing important in the conversation and I found the person verydisgusting.,2,209
I learned that my girlfriend had been unjustly missed from work.,3,210
When I entered the dissecting room for the first time. I think Ifelt disgusted mainly because of the bad smell of formaline.,2,211
When I came again in contact with a girl I liked very much. Andmost important she also liked me.,4,212
I had failed some subjects in mathematics.,1,213
When colliding with my car. I myself was to blame.,3,214
In 1972 I failed my Examination because of my own crookybehaviour of dodging from Examinations.,6,215
When I beat up my brother in order to control him and make himobey my parents orders.,2,216
